{
  "$schema": "ops/schemas/release-lane-summary.schema.json",
  "artifact_kind": "release_lane_summary",
  "generated_at": "2026-05-15T10:18:43Z",
  "producer": "ops.scripts.release_lane_summary",
  "source_command": "python -m ops.scripts.release_lane_summary --vault . --out ops/reports/release-lane-summary.json",
  "source_revision": "unknown",
  "source_tree_fingerprint": "17b2ceadf48e508e81cef28ba9c60bd259419e9214727bbea22971e41d986dae",
  "input_fingerprints": {
    "policy": "ebc1bcb948ab54d95dc99bbaed08fbd75b5756dc943c94aa3e2db6321170488f",
    "schema": "0d52985f1a335ba2c86dcfcd891717a3c35fc67c6a4f95df49e73822041aa523",
    "artifact_envelope_schema": "87fcb7b91ffc04e8180c1c3e51e309cde186ecf23f91f7974a541d0b580976de",
    "source_paths": "e61b0bc0bda4784ff61850ac5b3d8f5a63b95209cdd9f1e84e6e4142763be1a0",
    "learning_delta_scoreboard": "63b5eb75c4402549330b213a08c10a70615ea784f2bbda27d3e5418ba786e163",
    "release_closeout_summary": "eeb422a7e6eeba070c52120482ef0631f5af3b68a6a9ac8665a16409e986fa57",
    "release_evidence_cohort": "3fbc0ce76c245c6116c703e9e6565b820f436cfa927b0af7ae596891f6c166ae",
    "release_evidence_dashboard": "5120f50e7e86fc2d797f737b911efeb8e251d3215dfe017d87e60e96c13ec908",
    "current_source_tree_fingerprint": "a761e484f6727c259b235e038726b68d7184dbec044ec42beb2ef499f4617123"
  },
  "schema_version": 1,
  "artifact_status": "current",
  "retention_policy": "canonical_report",
  "encoding": "utf-8",
  "currentness": {
    "status": "current",
    "checked_at": "2026-05-15T10:18:43Z"
  },
  "vault": ".",
  "policy": {
    "path": "ops/policies/wiki-maintainer-policy.yaml",
    "version": 4
  },
  "status": "pass",
  "lane_summary": {
    "cohort_status": "pass",
    "clean_lane_status": "pass",
    "conditional_lane_status": "pass",
    "auto_improve_lane_status": "pass",
    "learning_lane_status": "pass",
    "machine_release_status": "allowed",
    "operator_release_status": "allowed",
    "release_authority_status": "clean_pass",
    "sealed_release_status": "unsealed_distribution_not_provided",
    "learning_claim_guard_status": "pass",
    "learning_claim_allowed": true,
    "claims_learning_improved": true,
    "accepted_risk_family_count": 0,
    "accepted_risk_instance_count": 0,
    "accepted_risk_count": 0,
    "gate_attention_count": 0,
    "clean_lane_blocking_family_count": 0,
    "learning_claim_blocking_family_count": 0,
    "advisory_lifecycle_family_count": 0
  },
  "provenance": {
    "cohort_source": "ops/reports/release-evidence-cohort.json",
    "closeout_source": "ops/reports/release-closeout-summary.json",
    "dashboard_source": "ops/reports/release-evidence-dashboard.json",
    "learning_delta_scoreboard_source": "ops/reports/learning-delta-scoreboard.json"
  }
}
